"","X","descr"
"3501",3531,"Calls upon Israel to become party to the Treaty on the Non-Proliferation of Nuclear Weapons to accede to it without further delay, and not to develop, produce, test or otherwise acquire nuclear weapons and to renounce possession of nuclear weap"
"3502",3532,"Education and information for disarmament"
"3503",3533,"Question of Antarctica"
"3504",3534,"Expresses concern with South Africa's participation in the Antarctica Treaty System"
"3505",3535,"Review of the Implementation of the Declaration on the Strengthening of International Security"
"3506",3536,"Elaboration of a 2nd optional protocol to the International Covenant on Civil and Political Rights, aiming at the abolition of the death penalty"
"3507",3537,"Indivisibility and interdependence of economic, social, cultural, civil and political rights"
"3508",3538,"Respect for the principles of national sovereignty and non interference in the internal affairs of States in their electoral processes"
"3509",3539,"Situation of human rights in Chile"
"3510",3540,"Enlargement of the Commission on Human Rights and the further promotion of human rights and fundamental freedoms"
"3511",3541,"International assistance for the economic rehabilitation of Angola"
"3512",3542,"Charter of Economic Rights and Duties of States"
"3513",3543,"Living conditions of the Palestinian people in the occupied Palestinian territory"
"3514",3544,"Special assistance to frontline States"
"3515",3545,"Enhanced international cooperation towards a durable solution to the external debt problems of developing countries"
"3516",3546,"Specific action related to the particular needs and problems of land locked developing countries"
"3517",3547,"Economic measures as a means of political and economic coercion against developing countries"
"3518",3548,"Regrets the unilateral trade embargo and other measures imposed against Nicaragua and requests that those measures be immediately revoked"
"3519",3549,"Urges all parties involved to meet agreed commitments and work for a balanced approach to the multilateral trade negotiations within the Uruguay Round of multilateral trade negotiations, so as to ensure that their successful conclusion brings a"
"3520",3550,"Trends in the transfer of resources to and from the developing countries and their impact on the economic growth and sustained development of those countries"
"3521",3551,"Requests the relevant programmes, organizations, agencies, funds and organs of the United Nations system to intensify their efforts, in co-operation with the Palestine Liberation Organization, to provide economic and social assistance to the Pa"
"3522",3552,"Strongly deplores the intervention in Panama by the armed forces of the United States of America. Demands the immediate cessation of the intervention and the withdrawal from Panama"
"3523",3553,"Question of the Comorian island of Mayotte"
"3524",3554,"Information from Non-Self-Governing Territories transmitted under Article 73e of the Charter of the UN"
"3525",3555,"Activities of foreign economic and other interests which are Impeding the implementation of the Declaration on the Granting of Independence to Colonial Countries and Peoples in Territories under colonial domination and efforts to eliminate colo"
"3526",3556,"Implementation of the Declaration on the Granting of Independence to Colonial Countries and Peoples by the specialized agencies and the international institutions associated with the UN"
"3527",3557,"Question of Guam"
"3528",3558,"30th Anniversary of the Declaration on the Granting of Independence to Colonial Countries and Peoples"
"3529",3559,"Implementation of the Declaration on the Granting of Independence to Colonial Countries and Peoples"
"3530",3560,"Dissemination of information on decolonization"
"3531",3561,"Zone of peace and cooperation of the South Atlantic"
"3532",3562,"Observer status of national liberation movements recognized by the OAU and/or by the League of Arab States"
"3533",3563,"Consideration of effective measures to enhance the protection, security and safety of diplomatic and consular missions and representatives"
"3534",3564,"Report of the Special Committee on the Charter of UN and on the Strengthening of the Role of the Organization"
"3535",3565,"Rationalization of existing UN procedures"
"3536",3566,"Implementation of General Assembly resolution 44/104 concerning the signature and ratification of Additional Protocol I of the Treaty for the Prohibition of Nuclear Weapons in Latin America and the Caribbean (Treaty of Tlatelolco)"
"3537",3567,"Cessation of all nuclear test explosions"
"3538",3568,"Amendment of the Treaty Banning Nuclear Weapon Tests in the Atmosphere, in Outer Space and under Water"
"3539",3569,"Urgent need for a comprehensive nuclear-test-ban treaty :"
"3540",3570,"Establishment of a nuclear-weapon-free zone in South Asia"
"3541",3571,"Conclusion of effective international arrangements to assure non nuclear weapon States against the use or threat of use of nuclear weapons"
"3542",3572,"Prevention of an arms race in outer space"
"3543",3573,"Confidencebuilding measures In outer space"
"3544",3574,"Implementation of the Declaration on the Denuclearization of Africa"
"3545",3575,"Condemns South Africa's continued pursuit of a nuclear capability and all forms of nuclear collaboration by any State, corporation, institution or individual with the racist regime that enable it to frustrate the objective of the Declaration wh"
"3546",3576,"Calls upon the Government of the Union of Soviet Socialist Republics and the Government of the United States of America to spare no effort in seeking the attainment of their agreed objectives in the negotiations, in accordance with the security"
"3547",3577,"Bilateral nuclear arms negotiations"
"3548",3578,"Prohibition of attacks on nuclear facilities"
"3549",3579,"Calls upon all States to ensure that no radioactive waste is dumped in the territory of other States in infringement of their sovereignty. Expresses profound concern regarding practices of dumping nuclear and industrial wastes in Africa, which"
"3550",3580,"Prohibition of the production of fissionable material for weapons purposes"
"3551",3581,"Charting potential uses of resources allocated to military activities for civilian endeavours to protect the environment"
"3552",3582,"Defensive security concepts and policies"
"3553",3583,"Regional disarmament"
"3554",3584,"Convention on the Prohibition of the Use of Nuclear Weapons"
"3555",3585,"Nuclear arms freeze"
"3556",3586,"Scientific and technological developments and their impact on international security"
"3557",3587,"Cessation of the nuclear arms race and nuclear disarmament and prevention of nuclear war"
"3558",3588,"Report of the Conference on Disarmament"
"3559",3589,"Comprehensive Programme on Disarmament"
"3560",3590,"Calls upon Israel to become party to the Treaty on the Non-Proliferation of Nuclear Weapons to accede to it without further delay, and not to develop, produce, test or otherwise acquire nuclear weapons and to renounce possession of nuclear weap"
"3561",3591,"Affirms the inalienable rights of the Palestinian people and sets the programme of work for the Committee on Palestinian rights"
"3562",3592,"Sets the programme of work for the committee on Palestinian rights"
"3563",3593,"Requests the Department of Public Information of the Secretariat to assist in the worldwide dissemination of 'accurate and comprehensive information' in support for the inalienable rights of the Palestinian people'"
"3564",3594,"Calls for the convening of the International Peace Conference on the Middle East, under the auspices of the United Nations, with the participation of all parties to the conflict, including the Palestine Liberation Organization, on an equal foot"
"3565",3595,"Condemns those policies and practices of Israel, the occupying Power, which violate the human rights wof the Palestinian people in the occupied Palestinian territory, including Jerusalem, and, in particular, such acts as the opening of fire by"
"3566",3596,"Urges all Member States to extend and expedite aid and assistance to the relief agency. Notes with regret that repatriation or compensation of the refugees, as provided for in paragraph 11 of its resolution 194 (III), has not yet been effected"
"3567",3597,"Offers by Member States of grants and scholarships for higher education, including vocational training, for Palestine refugees"
"3568",3598,"Strongly reiterates its demand that Israel desist from the removal and resettlement of Palestine refugees in the Palestinian territory occupied  by Israel since 1967 and from the destruction of their shelters"
"3569",3599,"Calls once again upon all Governments, as a matter of urgency, to make the most generous efforts possible and to offer the necessary resources to meet the needs of the United Nations Relief and Works Agency for Palestine Refugees in the Near Ea"
"3570",3600,"Reaffirms the inalienable right of all displaced inhabitants to return to their homes or former places of residence in the territories occupied by Israel since 1967, and declares once more that any attempt to restrict, or to attach conditions t"
"3571",3601,"Reaffirms that the Palestine Arab refugees are entitled to their property and to the income derived therefrom, in conformity with the principles of justice and equity"
"3572",3602,"Holds Israel responsible for the security of the Palestine refugees in the occupied Palestinian territory, including Jerusalem, and other Arab territories occupied by Israel since 1967, and calls upon it to fulfil its obligations as the occupyi"
"3573",3603,"Emphasizes the need for strengthening the educational system in the Palestinian territory occupied by Israel since 5 June 1967, including Jerusalem, and specifically the need for the establishment of the proposed university and Requests the Sec"
"3574",3604,"Protection of Palestinian students and educational institutions and safeguarding of the security of the facilities of the UN Relief and Works Agency for Palestine Refugees in the Near East in the occupied Palestinian territory"
"3575",3605,"the Special Committee, pending complete termination of the Israeli occupation, to continue to investigate Israeli policies and practices in the occupied Palestinian territory, including Jerusalem, and other Arab territories occupied by Israel s"
"3576",3606,"Requests Israel to respect the Geneva convention pretaining to persons in times of war"
"3577",3607,"Illegality of Israeli measures threatening the legal status, geographical nature and demographic composition of the occupied territories"
"3578",3608,"Deplores the arbitrary detention or imprisonment by Israel of thousands of Palestinians as a result of their resistance to occupation in order to attain self-determination, Calls upon Israel, the occupying Power, to release all Palestinians and"
"3579",3609,"Demands that Israel come into compliance with previous UN resolutions"
"3580",3610,"Affirms the illegality of Israel's occupation and transformation of the Golan heights"
"3581",3611,"Delpores the continued actions by Israel against Palestinian students and educational institutions"
"3582",3612,"Implementation of the Declaration of the Indian Ocean as a Zone of Peace"
"3583",3613,"Question Of Antarctica"
"3584",3614,"Expresses concern with South Africa's participation in the Antarctica Treaty System"
"3585",3615,"Review of the Implementation of the Declaration on the Strengthening of International Security"
"3586",3616,"Cooperation between UN and the League of Arab States"
"3587",3617,"Reaffirms its conviction that the question of Palestine is the core of the conflict in the Middle East and that no comprehensive, just and lasting peace in the region will be achieved without the full exercise by the Palestinian people of its i"
"3588",3618,"Deplores Israel's continued ignoring of UN resolutions; calls for the severing of ties with Israel"
"3589",3619,"Determines that all legislative and administrative measures and actions taken by Israel, the occupying Power, which have altered or purported to alter the character and status of the Holy City of Jerusalem, in particular the so-called Basic Law"
"3590",3620,"Adverse consequences for the enjoyment of human rights of political, military, economic and other forms of assistance given to the racist and colonialist regime of South Africa"
"3591",3621,"Notes with deep concern the continuing deterioration of the economic and social situation of the world, in particular in the developing countries, whose position has been further worsened by sharp fluctuations in exchange rates, high real rates"
"3592",3622,"Status of the International Convention on the Suppression and Punishment of the crime of Apartheid"
"3593",3623,"Alternative approaches and ways and means within the UN system for improving the effective enjoyment of human rights and fundamental freedoms"
"3594",3624,"Importance of the universal realization of the rights of peoples to self determination and of the speedy granting of independence to colonial countries and peoples for the effective guarantee and observance of human rights"
"3595",3625,"Use of mercenaries as a means to violate human rights and to impede the exercise of the right of peoples to self determination"
"3596",3626,"Calls upon all States that have not done so to become parties to the United Nations Convention on the Law of the Sea and to ratify, confirm formally or accede to the Agreement relating to the implementation of Part XI of the United Nations Conv"
"3597",3627,"Enhancing the effectiveness of the principle of periodic and genuine elections"
"3598",3628,"Respect for the principles of national sovereignty and non interference in the internal affairs of States in their electoral processes"
"3599",3629,"International Year for the World's Indigenous People"
"3600",3630,"The situation of human rights in occupied Kuwait"
"3601",3631,"Concerted and effective measures aimed at eradicating apartheid"
"3602",3632,"Strongly deplores the actions of those States and organizations which directly or indirectly continue to violate the arms embargo and collaborate with South Africa in the military, nuclear, intelligence and technology fields"
"3603",3633,"strongly condemns the continuing and increasing collaboration of Israel with the racist regime of South Africa, especially in the economic, military and nuclear fields;"
"3604",3634,"Programme of work of the Special Committee against Apartheid"
"3605",3635,"Requests all States concerned, pending a decision by the Security Council, to adopt effective measures and/or legislation to broaden the scope of the oil embargo in order to ensure the complete cessation of the supply and shipping of oil and pe"
"3606",3636,"Support for the work of the Commission against Apartheid in Sports"
"3607",3637,"Requests the relevant programmes, organizations, agencies, funds and organs of the United Nations system to intensify their efforts, in co-operation with the Palestine Liberation Organization, to provide economic and social assistance to the Pa"
"3608",3638,"Entrepreneurship"
"3609",3639,"Question of the Comorian island of Mayotte"
"3610",3640,"Return or restitution of cultural property to the countries of origin"
"3611",3641,"Report of the International Atomic Energy Agency"
"3612",3642,"Zone of peace and cooperation of the South Atlantic"
"3613",3643,"Cooperation between UN and the League of Arab States"
"3614",3644,"Amendment of the Treaty Banning Nuclear Weapon Tests in the Atmosphere, in Outer Space and under Water"
"3615",3645,"Comprehensive Nuclear-Test-Ban Treaty"
"3616",3646,"Establishment of a nuclear-weapon-free zone in South Asia"
"3617",3647,"Conclusion of effective international arrangements to assure non nuclear weapon States against the use or threat of use of nuclear weapons"
"3618",3648,"Prevention of an arms race in outer space"
"3619",3649,"Condemns South Africa's continued pursuit of a nuclear capability and all forms of nuclear collaboration by any State, corporation, institution or individual with the racist regime that enable it to frustrate the objective of the Declaration wh"
"3620",3650,"Prohibition of the production of fissionable material for weapons purposes"
"3621",3651,"Regional disarmament"
"3622",3652,"Bilateral nuclear arms negotiations"
"3623",3653,"Reaffirms its determination to ensure the effective operation of the United Nations Register of Conventional Arms"
"3624",3654,"Nuclear arms freeze"
"3625",3655,"Convention on the Prohibition of the Use of Nuclear Weapons"
"3626",3656,"UN Regional Centre for Peace and Disarmament in Africa, UN Regional Centre for Peace and Disarmament in Asia and the Pacific and UN Regional Centre for Peace, Disarmament and Development in Latin America and the Caribbean"
"3627",3657,"Comprehensive programme of disarmament"
"3628",3658,"Report of the Conference on Disarmament"
"3629",3659,"Calls upon Israel to become party to the Treaty on the Non-Proliferation of Nuclear Weapons to accede to it without further delay, and not to develop, produce, test or otherwise acquire nuclear weapons and to renounce possession of nuclear weap"
"3630",3660,"Question of Antarctica"
"3631",3661,"Expresses concern with South Africa's participation in the Antarctica Treaty System"
"3632",3662,"Urges all Member States to extend and expedite aid and assistance to the relief agency. Notes with regret that repatriation or compensation of the refugees, as provided for in paragraph 11 of its resolution 194 (III), has not yet been effected"
"3633",3663,"Offers by Member States of grants and scholarships for higher education, including vocational training, for Palestine refugees"
"3634",3664,"Strongly reiterates its demand that Israel desist from the removal and resettlement of Palestine refugees in the Palestinian territory occupied  by Israel since 1967 and from the destruction of their shelters"
"3635",3665,"Calls once again upon all Governments, as a matter of urgency, to make the most generous efforts possible and to offer the necessary resources to meet the needs of the United Nations Relief and Works Agency for Palestine Refugees in the Near Ea"
"3636",3666,"Reaffirms the inalienable right of all displaced inhabitants to return to their homes or former places of residence in the territories occupied by Israel since 1967, and declares once more that any attempt to restrict, or to attach conditions t"
"3637",3667,"Reaffirms that the Palestine Arab refugees are entitled to their property and to the income derived therefrom, in conformity with the principles of justice and equity"
"3638",3668,"Holds Israel responsible for the security of the Palestine refugees in the occupied Palestinian territory, including Jerusalem, and other Arab territories occupied by Israel since 1967, and calls upon it to fulfil its obligations as the occupyi"
"3639",3669,"Emphasizes the need for strengthening the educational system in the Palestinian territory occupied by Israel since 5 June 1967, including Jerusalem, and specifically the need for the establishment of the proposed university and Requests the Sec"
"3640",3670,"Protection of Palestinian students and educational institutions and safeguarding of the security of the facilities of the UN Relief and Works Agency for Palestine Refugees in the Near East in the occupied Palestinian territory"
"3641",3671,"the Special Committee, pending complete termination of the Israeli occupation, to continue to investigate Israeli policies and practices in the occupied Palestinian territory, including Jerusalem, and other Arab territories occupied by Israel s"
"3642",3672,"Requests Israel to respect the Geneva convention pretaining to persons in times of war"
"3643",3673,"Illegality of Israeli measures threatening the legal status, geographical nature and demographic composition of the occupied territories"
"3644",3674,"Deplores the arbitrary detention or imprisonment by Israel of thousands of Palestinians as a result of their resistance to occupation in order to attain self-determination, Calls upon Israel, the occupying Power, to release all Palestinians and"
"3645",3675,"Demands that Israel come into compliance with previous UN resolutions"
"3646",3676,"Affirms the illegality of Israel's occupation and transformation of the Golan heights"
"3647",3677,"Delpores the continued actions by Israel against Palestinian students and educational institutions"
"3648",3678,"Implementation of the Declaration of the Indian Ocean as a Zone of Peace"
"3649",3679,"Progressive development of the principles and norms of international law relating to the new international economic order"
"3650",3680,"Information from Non-Self-Governing Territories transmitted under Article 73e of the Charter of the UN"
"3651",3681,"Activities of foreign economic and other interests which are Impeding the implementation of the Declaration on the Granting of Independence to Colonial Countries and Peoples in Territories under colonial domination and efforts to eliminate colo"
"3652",3682,"Implementation of the Declaration on the Granting of Independence to Colonial Countries and Peoples by the specialized agencies and the international institutions associated with the UN"
"3653",3683,"Implementation of the Declaration on the Granting of Independence to Colonial Countries and Peoples"
"3654",3684,"Dissemination of information on decolonization"
"3655",3685,"Affirms the inalienable rights of the Palestinian people and sets the programme of work for the Committee on Palestinian rights"
"3656",3686,"Sets the programme of work for the committee on Palestinian rights"
"3657",3687,"Requests the Department of Public Information of the Secretariat to assist in the worldwide dissemination of 'accurate and comprehensive information' in support for the inalienable rights of the Palestinian people'"
"3658",3688,"Calls for the convening of the International Peace Conference on the Middle East, under the auspices of the United Nations, with the participation of all parties to the conflict, including the Palestine Liberation Organization, on an equal foot"
"3659",3689,"Condemns those policies and practices of Israel, the occupying Power, which violate the human rights wof the Palestinian people in the occupied Palestinian territory, including Jerusalem, and, in particular, such acts as the opening of fire by"
"3660",3690,"Calls upon all States that have not done so to become parties to the United Nations Convention on the Law of the Sea and to ratify, confirm formally or accede to the Agreement relating to the implementation of Part XI of the United Nations Conv"
"3661",3691,"Programme of work of the Special Committee against Apartheid"
"3662",3692,"Strongly deplores the actions of those States and organizations which directly or indirectly continue to violate the arms embargo and collaborate with South Africa in the military, nuclear, intelligence and technology fields"
"3663",3693,"strongly condemns the continuing and increasing collaboration of Israel with the racist regime of South Africa, especially in the economic, military and nuclear fields;"
"3664",3694,"Requests all States concerned, pending a decision by the Security Council, to adopt effective measures and/or legislation to broaden the scope of the oil embargo in order to ensure the complete cessation of the supply and shipping of oil and pe"
"3665",3695,"Reaffirms its conviction that the question of Palestine is the core of the conflict in the Middle East and that no comprehensive, just and lasting peace in the region will be achieved without the full exercise by the Palestinian people of its i"
"3666",3696,"Deplores Israel's continued ignoring of UN resolutions; calls for the severing of ties with Israel"
"3667",3697,"Status of the International Convention on the Suppression and Punishment of the crime of Apartheid"
"3668",3698,"Revokes earlier determination of resolution 3379 that equates zionism with racism"
"3669",3699,"Importance of the universal realization of the rights of peoples to self determination and of the speedy granting of independence to colonial countries and peoples for the effective guarantee and observance of human rights"
"3670",3700,"Use of mercenaries as a means to violate human rights and to impede the exercise of the right of peoples to self determination"
"3671",3701,"Notes with deep concern the continuing deterioration of the economic and social situation of the world, in particular in the developing countries, whose position has been further worsened by sharp fluctuations in exchange rates, high real rates"
"3672",3702,"Alternative approaches and ways and means within the UN system for improving the effective enjoyment of human rights and fundamental freedoms"
"3673",3703,"Respect for the principles of national sovereignty and non interference in the internal affairs of States in their electoral processes"
"3674",3704,"Situation of human rights in Iraq"
"3675",3705,"Situation of human rights in Kuwait under Iraqi occupation"
"3676",3706,"Enhancing the effectiveness of the principle of periodic and genuine elections"
"3677",3707,"UN African Institute for the Prevention of Crime and the Treatment of Offenders"
"3678",3708,"Living conditions of the Palestinian people in the occupied Palestinian territory"
"3679",3709,"Adverse economic effects of Israeli settlements in the occupied Palestinian territory, including Jerusalem, and other Arab territories occupied since 1967"
